{
  "files": [
    {
      "path": "src/db.js",
      "side": "head",
      "oid": "1111111111111111111111111111111111111111",
      "file_hmac": "bbbbbbbbbbbbbbbbbbbbbbbbbbbbbbbbbbbbbbbbbbbbbbbbbbbbbbbbbbbbbbbb",
      "lines": 120
    },
    {
      "path": "src/tmp.js",
      "side": "snapshot",
      "oid": "cccccccccccccccccccccccccccccccccccccccccccccccccccccccccccccccc",
      "file_hmac": "dddddddddddddddddddddddddddddddddddddddddddddddddddddddddddddddd",
      "lines": 3
    }
  ],
  "ranges": {
    "src/db.js": [
      [
        1,
        40
      ],
      [
        41,
        80
      ],
      [
        81,
        120
      ]
    ],
    "src/tmp.js": [
      [
        1,
        3
      ]
    ]
  },
  "skipped": [
    {
      "path": "assets/logo.png",
      "reason": "binary"
    }
  ],
  "snapshot": {
    "src/tmp.js": {
      "original_hmac": "dddddddddddddddddddddddddddddddddddddddddddddddddddddddddddddddd",
      "redacted_sha256": "cccccccccccccccccccccccccccccccccccccccccccccccccccccccccccccccc",
      "redaction_version": 1
    }
  }
}
